{
  "$schema": "https://github.com/BuzzelStudio/unity-build-workflows/docker/metadata/image-manifest.schema.json",
  "schemaVersion": "1.0.0",
  "contractVersion": 1,
  "imageReference": "ghcr.io/buzzelstudio/unity-android:2022.3.45f1",
  "imageDigest": "sha256:aaaaaaaaaaaaaaaaaaaaaaaaaaaaaaaaaaaaaaaaaaaaaaaaaaaaaaaaaaaaaaaa",
  "unityVersion": "2022.3.45f1",
  "variant": "android",
  "buildTimestamp": "2026-06-12T10:00:00Z",
  "modules": ["android", "android-sdk-ndk-tools"],
  "supportedTargets": ["Android"],
  "supportedScriptingBackends": ["IL2CPP", "Mono"],
  "androidSdkVersion": 34,
  "androidNdkVersion": "r23b",
  "jdkVersion": "17.0.9",
  "osVersion": "Ubuntu 22.04.4 LTS",
  "toolingVersion": "1.0.0",
  "sourceCommit": "5bd161f"
}
